{
  "affected_knowledge_ids": [],
  "can_promote_to_knowledge": false,
  "change_summary": {
    "added_line_count": 1,
    "added_sample": [
      "{\"self\":\"https:\\/\\/www.drupal.org\\/api-d7\\/node?type=changenotice\\u0026field_project=3060\\u0026sort=created\\u0026direction=DESC\\u0026limit=20\",\"first\":\"https:\\/…"
    ],
    "changed_region_count": 1,
    "current_bytes": 59844,
    "current_line_count": 1,
    "deterministic": true,
    "first_changed_line": 1,
    "method": "normalized_line_diff",
    "previous_bytes": 64827,
    "previous_line_count": 1,
    "removed_line_count": 1,
    "removed_sample": [
      "{\"self\":\"https:\\/\\/www.drupal.org\\/api-d7\\/node?type=changenotice\\u0026field_project=3060\\u0026sort=created\\u0026direction=DESC\\u0026limit=20\",\"first\":\"https:\\/…"
    ]
  },
  "current_hash": "sha256:b863651eb706e1138b84f8bdaf6af46ae99e0e118570273e9abea85c9f852c9c",
  "discovered_at": "2026-10-28T05:46:18Z",
  "engine_version": "0.1",
  "id": "source-change.drupal-core-change-notices.511b6c6ffb0ed06d",
  "is_knowledge_proposal": false,
  "kind": "release-source-change",
  "previous_hash": "sha256:131cbc61106ced04d6376e00c46ea307f710c39a1378a34cf5f7d36e97aa626b",
  "provenance": {
    "acquired_at": "2026-10-28T05:46:18Z",
    "acquired_by": {
      "name": "drupal-knowledge-acquisition-engine",
      "version": "0.1"
    },
    "acquisition_channel": "external_authoritative_source",
    "canonical_url": "https://www.drupal.org/list-changes/drupal",
    "category": "change-records",
    "content_length": 59844,
    "content_type": "application/json",
    "content_window": null,
    "etag": null,
    "fetch_url": "https://www.drupal.org/api-d7/node.json?type=changenotice&field_project=3060&sort=created&direction=DESC&limit=20",
    "http_status": 200,
    "last_modified": null,
    "normalization": "raw_text",
    "trust": "authoritative"
  },
  "review": null,
  "review_required": true,
  "review_state": "pending_review",
  "run_id": "run.20261028T054618.7d67b285",
  "source_id": "drupal-core-change-notices",
  "source_url": "https://www.drupal.org/list-changes/drupal",
  "status": "review_required",
  "summary": "Registered source content changed. A human review must decide whether trusted Drupal knowledge is affected.",
  "trust": "authoritative"
}
