{
  "affected_knowledge_ids": [],
  "can_promote_to_knowledge": false,
  "change_summary": {
    "added_line_count": 1,
    "added_sample": [
      "{\"self\":\"https:\\/\\/www.drupal.org\\/api-d7\\/node?type=sa\\u0026sort=created\\u0026direction=DESC\\u0026limit=20\",\"first\":\"https:\\/\\/www.drupal.org\\/api-d7\\/node?typ…"
    ],
    "changed_region_count": 1,
    "current_bytes": 95994,
    "current_line_count": 1,
    "deterministic": true,
    "first_changed_line": 1,
    "method": "normalized_line_diff",
    "previous_bytes": 81565,
    "previous_line_count": 1,
    "removed_line_count": 1,
    "removed_sample": [
      "{\"self\":\"https:\\/\\/www.drupal.org\\/api-d7\\/node?type=sa\\u0026sort=created\\u0026direction=DESC\\u0026limit=20\",\"first\":\"https:\\/\\/www.drupal.org\\/api-d7\\/node?typ…"
    ]
  },
  "current_hash": "sha256:a207b9bccf8cfe818d0f4108ac253d4ad609e7ee54cdf20569517304a74e5ee2",
  "discovered_at": "2026-10-29T05:52:02Z",
  "engine_version": "0.1",
  "id": "source-change.drupal-security-advisories-recent.bd2c9cf1dbf099ee",
  "is_knowledge_proposal": false,
  "kind": "security-source-change",
  "previous_hash": "sha256:39188968a27def4cf53c23d725f2c7104db4a384c9c0317f5db5f5b99236cbd5",
  "provenance": {
    "acquired_at": "2026-10-29T05:52:02Z",
    "acquired_by": {
      "name": "drupal-knowledge-acquisition-engine",
      "version": "0.1"
    },
    "acquisition_channel": "external_authoritative_source",
    "canonical_url": "https://www.drupal.org/security/contrib",
    "category": "security",
    "content_length": 95994,
    "content_type": "application/json",
    "content_window": null,
    "etag": null,
    "fetch_url": "https://www.drupal.org/api-d7/node.json?type=sa&sort=created&direction=DESC&limit=20",
    "http_status": 200,
    "last_modified": null,
    "normalization": "raw_text",
    "trust": "authoritative"
  },
  "review": null,
  "review_required": true,
  "review_state": "pending_review",
  "run_id": "run.20261029T055202.9a6be703",
  "source_id": "drupal-security-advisories-recent",
  "source_url": "https://www.drupal.org/security/contrib",
  "status": "review_required",
  "summary": "Registered source content changed. A human review must decide whether trusted Drupal knowledge is affected.",
  "trust": "authoritative"
}
