{
  "affected_knowledge_ids": [],
  "can_promote_to_knowledge": false,
  "change_summary": {
    "added_line_count": 1,
    "added_sample": [
      "<release><name>drupal 12.0.0-beta1</name><version>12.0.0-beta1</version><tag>12.0.0-beta1</tag><status>published</status><release_link>https://www.drupal.org/pr…"
    ],
    "changed_region_count": 1,
    "current_bytes": 552773,
    "current_line_count": 14,
    "deterministic": true,
    "first_changed_line": 13,
    "method": "normalized_line_diff",
    "previous_bytes": 552773,
    "previous_line_count": 14,
    "removed_line_count": 1,
    "removed_sample": [
      "<release><name>drupal 12.0.0-beta1</name><version>12.0.0-beta1</version><tag>12.0.0-beta1</tag><status>published</status><release_link>https://www.drupal.org/pr…"
    ]
  },
  "current_hash": "sha256:17d74f618c08341c26d4873ae863b314bc94f6f4eabf65aa8f68c74bc2c4071f",
  "discovered_at": "2026-10-12T15:31:27Z",
  "engine_version": "0.1",
  "id": "source-change.drupal-core-releases.6e60b4d596e0068e",
  "is_knowledge_proposal": false,
  "kind": "security-source-change",
  "previous_hash": "sha256:a1df16c200a25e55ed049718fb5e10c16d332df68288a65affbf35eda61bdc2e",
  "provenance": {
    "acquired_at": "2026-10-12T15:31:27Z",
    "acquired_by": {
      "name": "drupal-knowledge-acquisition-engine",
      "version": "0.1"
    },
    "acquisition_channel": "external_authoritative_source",
    "canonical_url": "https://www.drupal.org/project/drupal/releases",
    "category": "core-releases",
    "content_length": 552773,
    "content_type": "text/xml; charset=utf-8",
    "content_window": null,
    "etag": null,
    "fetch_url": "https://updates.drupal.org/release-history/drupal/current",
    "http_status": 200,
    "last_modified": "Mon, 12 Oct 2026 10:49:45 GMT",
    "normalization": "raw_text",
    "trust": "authoritative"
  },
  "review": null,
  "review_required": true,
  "review_state": "pending_review",
  "run_id": "run.20261012T153127.a036aafc",
  "source_id": "drupal-core-releases",
  "source_url": "https://www.drupal.org/project/drupal/releases",
  "status": "review_required",
  "summary": "Registered source content changed. A human review must decide whether trusted Drupal knowledge is affected.",
  "trust": "authoritative"
}
