{
  "affected_knowledge_ids": [],
  "can_promote_to_knowledge": false,
  "change_summary": {
    "added_line_count": 12,
    "added_sample": [
      "12.1.x / 12.1.0",
      "27-Oct-2026",
      "Limited length in primary and unique keys is forbidden",
      "12.0.x / 12.0.0",
      "26-Oct-2026"
    ],
    "changed_region_count": 2,
    "current_bytes": 4235,
    "current_line_count": 153,
    "deterministic": true,
    "first_changed_line": 4,
    "method": "normalized_line_diff",
    "previous_bytes": 4300,
    "previous_line_count": 153,
    "removed_line_count": 12,
    "removed_sample": [
      "11.5.x / 11.5.0",
      "04-Sep-2026",
      "Functions in update.compare.inc are deprecated",
      "11.5.x / 11.5.0",
      "04-Sep-2026"
    ]
  },
  "current_hash": "sha256:f5bd7837f21cbd2560b7525645ceec87e139e7b36aff0a577ad6fa552b4a3557",
  "discovered_at": "2026-10-28T05:46:18Z",
  "engine_version": "0.1",
  "id": "source-change.drupal-core-change-records.beb5ea0aed83d502",
  "is_knowledge_proposal": false,
  "kind": "release-source-change",
  "previous_hash": "sha256:d4ebe0317e9552b85914ddc33b61c4158789702b66a959a4b0a03116746f9865",
  "provenance": {
    "acquired_at": "2026-10-28T05:46:18Z",
    "acquired_by": {
      "name": "drupal-knowledge-acquisition-engine",
      "version": "0.1"
    },
    "acquisition_channel": "external_authoritative_source",
    "canonical_url": "https://www.drupal.org/list-changes/drupal",
    "category": "change-records",
    "content_length": 4235,
    "content_type": "text/html; charset=utf-8",
    "content_window": {
      "end": "Pages",
      "start": "Introduced in branch/version"
    },
    "etag": "\"1793166380-1\"",
    "fetch_url": "https://www.drupal.org/list-changes/drupal",
    "http_status": 200,
    "last_modified": "Wed, 28 Oct 2026 05:46:20 GMT",
    "normalization": "auto",
    "trust": "authoritative"
  },
  "review": null,
  "review_required": true,
  "review_state": "pending_review",
  "run_id": "run.20261028T054618.7d67b285",
  "source_id": "drupal-core-change-records",
  "source_url": "https://www.drupal.org/list-changes/drupal",
  "status": "review_required",
  "summary": "Registered source content changed. A human review must decide whether trusted Drupal knowledge is affected.",
  "trust": "authoritative"
}
