{
  "affected_knowledge_ids": [],
  "can_promote_to_knowledge": false,
  "change_summary": {
    "added_line_count": 1,
    "added_sample": [
      "{\"self\":\"https:\\/\\/www.drupal.org\\/api-d7\\/node?type=sa\\u0026field_project=3060\\u0026sort=created\\u0026direction=DESC\\u0026limit=20\",\"first\":\"https:\\/\\/www.drup…"
    ],
    "changed_region_count": 1,
    "current_bytes": 155943,
    "current_line_count": 1,
    "deterministic": true,
    "first_changed_line": 1,
    "method": "normalized_line_diff",
    "previous_bytes": 155943,
    "previous_line_count": 1,
    "removed_line_count": 1,
    "removed_sample": [
      "{\"self\":\"https:\\/\\/www.drupal.org\\/api-d7\\/node?type=sa\\u0026field_project=3060\\u0026sort=created\\u0026direction=DESC\\u0026limit=20\",\"first\":\"https:\\/\\/www.drup…"
    ]
  },
  "current_hash": "sha256:b37d072cc4ce4e706870276008db1cb431afee486417b8661a82a662efdd3b1c",
  "discovered_at": "2026-09-27T21:22:50Z",
  "engine_version": "0.1",
  "id": "source-change.drupal-security-advisories-core.0bb61c4dc30d9669",
  "is_knowledge_proposal": false,
  "kind": "security-source-change",
  "previous_hash": "sha256:f483dc491cc501ba1a8e291ef9940ec115801d53f448c22baa57a4b0373d38c2",
  "provenance": {
    "acquired_at": "2026-09-27T21:22:50Z",
    "acquired_by": {
      "name": "drupal-knowledge-acquisition-engine",
      "version": "0.1"
    },
    "acquisition_channel": "external_authoritative_source",
    "canonical_url": "https://www.drupal.org/security/core",
    "category": "security",
    "content_length": 155943,
    "content_type": "application/json",
    "content_window": null,
    "etag": null,
    "fetch_url": "https://www.drupal.org/api-d7/node.json?type=sa&field_project=3060&sort=created&direction=DESC&limit=20",
    "http_status": 200,
    "last_modified": null,
    "normalization": "raw_text",
    "trust": "authoritative"
  },
  "review": null,
  "review_required": true,
  "review_state": "pending_review",
  "run_id": "run.20260927T212250.99986d78",
  "source_id": "drupal-security-advisories-core",
  "source_url": "https://www.drupal.org/security/core",
  "status": "review_required",
  "summary": "Registered source content changed. A human review must decide whether trusted Drupal knowledge is affected.",
  "trust": "authoritative"
}
