{
  "affected_knowledge_ids": [],
  "can_promote_to_knowledge": false,
  "change_summary": {
    "added_line_count": 1,
    "added_sample": [
      "<release><name>drupal 12.0.0-beta1</name><version>12.0.0-beta1</version><tag>12.0.0-beta1</tag><status>published</status><release_link>https://www.drupal.org/pr…"
    ],
    "changed_region_count": 1,
    "current_bytes": 550887,
    "current_line_count": 14,
    "deterministic": true,
    "first_changed_line": 13,
    "method": "normalized_line_diff",
    "previous_bytes": 549882,
    "previous_line_count": 14,
    "removed_line_count": 1,
    "removed_sample": [
      "<release><name>drupal 12.0.0-alpha1</name><version>12.0.0-alpha1</version><tag>12.0.0-alpha1</tag><status>published</status><release_link>https://www.drupal.org…"
    ]
  },
  "current_hash": "sha256:65b7eb73690f78d47e2fa36f9caf9beb1e289992c16dba280ba66c4aa73483f2",
  "discovered_at": "2026-10-01T05:59:32Z",
  "engine_version": "0.1",
  "id": "source-change.drupal-core-releases.85bcfd9b14a3ebc6",
  "is_knowledge_proposal": false,
  "kind": "security-source-change",
  "previous_hash": "sha256:efa6a8ea412444170fdd6f9beac49a806879bb8a82c06cf7d6d3c58b4a7423ba",
  "provenance": {
    "acquired_at": "2026-10-01T05:59:32Z",
    "acquired_by": {
      "name": "drupal-knowledge-acquisition-engine",
      "version": "0.1"
    },
    "acquisition_channel": "external_authoritative_source",
    "canonical_url": "https://www.drupal.org/project/drupal/releases",
    "category": "core-releases",
    "content_length": 550887,
    "content_type": "text/xml; charset=utf-8",
    "content_window": null,
    "etag": null,
    "fetch_url": "https://updates.drupal.org/release-history/drupal/current",
    "http_status": 200,
    "last_modified": "Wed, 30 Sep 2026 14:57:37 GMT",
    "normalization": "raw_text",
    "trust": "authoritative"
  },
  "review": null,
  "review_required": true,
  "review_state": "pending_review",
  "run_id": "run.20261001T055932.40132ed3",
  "source_id": "drupal-core-releases",
  "source_url": "https://www.drupal.org/project/drupal/releases",
  "status": "review_required",
  "summary": "Registered source content changed. A human review must decide whether trusted Drupal knowledge is affected.",
  "trust": "authoritative"
}
