{
  "affected_knowledge_ids": [],
  "can_promote_to_knowledge": false,
  "change_summary": {
    "added_line_count": 23,
    "added_sample": [
      "10.6.x, 11.3.x / 10.6.0, 11.3.20, 11.4.11",
      "20-Oct-2026",
      "Assertions options usage is deprecated",
      "11.6.x / 11.6.0",
      "16-Oct-2026"
    ],
    "changed_region_count": 4,
    "current_bytes": 4300,
    "current_line_count": 153,
    "deterministic": true,
    "first_changed_line": 4,
    "method": "normalized_line_diff",
    "previous_bytes": 4314,
    "previous_line_count": 153,
    "removed_line_count": 23,
    "removed_sample": [
      "11.x / 11.5.0",
      "12.0.x",
      "11.5.x / 11.5.0",
      "03-Sep-2026",
      "PostgreSQL type-casting of fields in raw SQL with LIKE and regex operators is deprecated"
    ]
  },
  "current_hash": "sha256:d4ebe0317e9552b85914ddc33b61c4158789702b66a959a4b0a03116746f9865",
  "discovered_at": "2026-10-21T04:52:54Z",
  "engine_version": "0.1",
  "id": "source-change.drupal-core-change-records.25acbab91faf05ce",
  "is_knowledge_proposal": false,
  "kind": "release-source-change",
  "previous_hash": "sha256:42a214966f8c86058245ed34cf9223cdf69d3fbdc7f8ad550dedcce72d7d0897",
  "provenance": {
    "acquired_at": "2026-10-21T04:52:54Z",
    "acquired_by": {
      "name": "drupal-knowledge-acquisition-engine",
      "version": "0.1"
    },
    "acquisition_channel": "external_authoritative_source",
    "canonical_url": "https://www.drupal.org/list-changes/drupal",
    "category": "change-records",
    "content_length": 4300,
    "content_type": "text/html; charset=utf-8",
    "content_window": {
      "end": "Pages",
      "start": "Introduced in branch/version"
    },
    "etag": "\"1792558376-1\"",
    "fetch_url": "https://www.drupal.org/list-changes/drupal",
    "http_status": 200,
    "last_modified": "Wed, 21 Oct 2026 04:52:56 GMT",
    "normalization": "auto",
    "trust": "authoritative"
  },
  "review": null,
  "review_required": true,
  "review_state": "pending_review",
  "run_id": "run.20261021T045254.e4f828e4",
  "source_id": "drupal-core-change-records",
  "source_url": "https://www.drupal.org/list-changes/drupal",
  "status": "review_required",
  "summary": "Registered source content changed. A human review must decide whether trusted Drupal knowledge is affected.",
  "trust": "authoritative"
}
