{
  "affected_knowledge_ids": [],
  "can_promote_to_knowledge": false,
  "change_summary": {
    "added_line_count": 1,
    "added_sample": [
      "<release><name>drupal 12.0.0-alpha1</name><version>12.0.0-alpha1</version><tag>12.0.0-alpha1</tag><status>published</status><release_link>https://www.drupal.org…"
    ],
    "changed_region_count": 1,
    "current_bytes": 546342,
    "current_line_count": 14,
    "deterministic": true,
    "first_changed_line": 13,
    "method": "normalized_line_diff",
    "previous_bytes": 546342,
    "previous_line_count": 14,
    "removed_line_count": 1,
    "removed_sample": [
      "<release><name>drupal 12.0.0-alpha1</name><version>12.0.0-alpha1</version><tag>12.0.0-alpha1</tag><status>published</status><release_link>https://www.drupal.org…"
    ]
  },
  "current_hash": "sha256:1fe0ae0f0bcfc7099b8ce95957bd5c27067003fddf4d2b266b25bf056017348a",
  "discovered_at": "2026-09-23T17:04:37Z",
  "engine_version": "0.1",
  "id": "source-change.drupal-core-releases.5de3b89f60124c43",
  "is_knowledge_proposal": false,
  "kind": "security-source-change",
  "previous_hash": "sha256:ec1b75d396c803c35bcf27323530acf7bd27b3415513cd51f98d0d58fb93635c",
  "provenance": {
    "acquired_at": "2026-09-23T17:04:37Z",
    "acquired_by": {
      "name": "drupal-knowledge-acquisition-engine",
      "version": "0.1"
    },
    "acquisition_channel": "external_authoritative_source",
    "canonical_url": "https://www.drupal.org/project/drupal/releases",
    "category": "core-releases",
    "content_length": 546342,
    "content_type": "text/xml; charset=utf-8",
    "content_window": null,
    "etag": null,
    "fetch_url": "https://updates.drupal.org/release-history/drupal/current",
    "http_status": 200,
    "last_modified": "Wed, 23 Sep 2026 14:37:20 GMT",
    "normalization": "raw_text",
    "trust": "authoritative"
  },
  "review": {
    "actor": "Miguel Martins",
    "authorizes_knowledge_proposal_work": false,
    "method": "human_source_diff_review",
    "note": "Structural comparison of the release-history XML: 559 releases before and after, none added, none removed. No release changed status, release-type terms or security coverage text. The only differences are the build date fields of the two rolling development snapshots 11.x-dev and dev-main. No published stable release moved, no Insecure transition, no supported-branch change; the 11.4.7 semantic-authority pin and the reviewed release-lifecycle context are unaffected. Timestamp-only movement on development artefacts.",
    "outcome": "reviewed_no_knowledge_change",
    "reviewed_at": "2026-09-23T18:37:09Z",
    "trusted_knowledge_changed": false
  },
  "review_required": true,
  "review_state": "reviewed_no_knowledge_change",
  "run_id": "run.20260923T170437.31ddcb7e",
  "source_id": "drupal-core-releases",
  "source_url": "https://www.drupal.org/project/drupal/releases",
  "status": "reviewed",
  "summary": "Registered source content changed. A human review must decide whether trusted Drupal knowledge is affected.",
  "trust": "authoritative"
}
