{
  "affected_knowledge_ids": [],
  "can_promote_to_knowledge": false,
  "change_summary": {
    "added_line_count": 1,
    "added_sample": [
      "{\"self\":\"https:\\/\\/www.drupal.org\\/api-d7\\/node?type=changenotice\\u0026field_project=3060\\u0026sort=created\\u0026direction=DESC\\u0026limit=20\",\"first\":\"https:\\/…"
    ],
    "changed_region_count": 1,
    "current_bytes": 67871,
    "current_line_count": 1,
    "deterministic": true,
    "first_changed_line": 1,
    "method": "normalized_line_diff",
    "previous_bytes": 73477,
    "previous_line_count": 1,
    "removed_line_count": 1,
    "removed_sample": [
      "{\"self\":\"https:\\/\\/www.drupal.org\\/api-d7\\/node?type=changenotice\\u0026field_project=3060\\u0026sort=created\\u0026direction=DESC\\u0026limit=20\",\"first\":\"https:\\/…"
    ]
  },
  "current_hash": "sha256:06569965487c18fffe367af84bc4618f0889ed1be9be8b570c1acbefb6ba5c35",
  "discovered_at": "2026-09-22T11:42:43Z",
  "engine_version": "0.1",
  "id": "source-change.drupal-core-change-notices.511bc8ebc2959a19",
  "is_knowledge_proposal": false,
  "kind": "release-source-change",
  "previous_hash": "sha256:2f00fe48197087de210c09af8fd203f08a62d338889e68875b69ee621bcf44eb",
  "provenance": {
    "acquired_at": "2026-09-22T11:42:43Z",
    "acquired_by": {
      "name": "drupal-knowledge-acquisition-engine",
      "version": "0.1"
    },
    "acquisition_channel": "external_authoritative_source",
    "canonical_url": "https://www.drupal.org/list-changes/drupal",
    "category": "change-records",
    "content_length": 67871,
    "content_type": "application/json",
    "content_window": null,
    "etag": null,
    "fetch_url": "https://www.drupal.org/api-d7/node.json?type=changenotice&field_project=3060&sort=created&direction=DESC&limit=20",
    "http_status": 200,
    "last_modified": null,
    "normalization": "raw_text",
    "trust": "authoritative"
  },
  "review": {
    "actor": "Miguel Martins",
    "authorizes_knowledge_proposal_work": true,
    "method": "human_editorial_review",
    "note": "Rolling change-record feed rotated in newly published Drupal 12.0.x removals and 11.5.x deprecations (Claro, Olivero, Search and Toolbar removal; Claro/Olivero/Toolbar deprecation; Node.js 24 for core development). Real lifecycle events that warrant API-lifecycle/change-record proposals as separate reviewed work. Items leaving the limit=20 window are outside the window, not retracted upstream.",
    "outcome": "reviewed_requires_knowledge_proposal",
    "reviewed_at": "2026-09-23T02:07:53Z",
    "trusted_knowledge_changed": false
  },
  "review_required": true,
  "review_state": "reviewed_requires_knowledge_proposal",
  "run_id": "run.20260922T114243.8345954e",
  "source_id": "drupal-core-change-notices",
  "source_url": "https://www.drupal.org/list-changes/drupal",
  "status": "reviewed",
  "summary": "Registered source content changed. A human review must decide whether trusted Drupal knowledge is affected.",
  "trust": "authoritative"
}
